{
  "$schema": "https://json-schema.org/draft/2020-12/schema",
  "$id": "https://github.com/tt-a1i/archify/schemas/lifecycle.schema.json",
  "title": "Archify Lifecycle Diagram",
  "type": "object",
  "additionalProperties": false,
  "required": [
    "schema_version",
    "diagram_type",
    "meta",
    "mainPath",
    "states",
    "transitions"
  ],
  "properties": {
    "schema_version": {
      "description": "Lifecycle uses version 3: an automatic main-path layout.",
      "const": 3
    },
    "diagram_type": {
      "const": "lifecycle"
    },
    "meta": {
      "type": "object",
      "additionalProperties": false,
      "required": [
        "title",
        "output"
      ],
      "properties": {
        "title": {
          "type": "string",
          "minLength": 1
        },
        "locale": {
          "$ref": "common.schema.json#/$defs/locale"
        },
        "translations": {
          "$ref": "common.schema.json#/$defs/translations"
        },
        "subtitle": {
          "type": "string"
        },
        "output": {
          "$ref": "common.schema.json#/$defs/portableOutputPath"
        },
        "animation": {
          "$ref": "common.schema.json#/$defs/animation"
        },
        "visual_preset": {
          "$ref": "common.schema.json#/$defs/visualPreset"
        },
        "quality_profile": {
          "$ref": "common.schema.json#/$defs/qualityProfile"
        },
        "repository": {
          "$ref": "common.schema.json#/$defs/repository"
        },
        "views": {
          "$ref": "common.schema.json#/$defs/guidedViews"
        },
        "legend": {
          "type": "object",
          "additionalProperties": false,
          "properties": {
            "mode": {
              "$ref": "common.schema.json#/$defs/legendMode"
            },
            "entries": {
              "type": "object",
              "additionalProperties": false,
              "properties": {
                "start": {
                  "$ref": "common.schema.json#/$defs/legendEntry"
                },
                "active": {
                  "$ref": "common.schema.json#/$defs/legendEntry"
                },
                "waiting": {
                  "$ref": "common.schema.json#/$defs/legendEntry"
                },
                "decision": {
                  "$ref": "common.schema.json#/$defs/legendEntry"
                },
                "success": {
                  "$ref": "common.schema.json#/$defs/legendEntry"
                },
                "failure": {
                  "$ref": "common.schema.json#/$defs/legendEntry"
                },
                "neutral": {
                  "$ref": "common.schema.json#/$defs/legendEntry"
                },
                "external": {
                  "$ref": "common.schema.json#/$defs/legendEntry"
                }
              }
            }
          }
        },
        "input_contract": {
          "const": "phoenix-v1"
        }
      }
    },
    "mainPath": {
      "description": "The happy path from the initial state, left to right. Each consecutive pair needs a transition. Every other state is placed below the state it branches from; transitions back to an earlier main-path state are drawn as loops above.",
      "type": "array",
      "minItems": 2,
      "items": {
        "$ref": "common.schema.json#/$defs/id"
      }
    },
    "states": {
      "type": "array",
      "minItems": 2,
      "items": {
        "type": "object",
        "additionalProperties": false,
        "required": [
          "id",
          "type",
          "label"
        ],
        "properties": {
          "id": {
            "$ref": "common.schema.json#/$defs/id"
          },
          "type": {
            "description": "start: the initial state. active: work in progress. waiting: paused for a person, time, or input. decision: a review or branch point (Mermaid <<choice>>). success / failure: a good or bad outcome. neutral: parked, or ended without success or failure. external: handled by an outside party. Color and the default corner sigil follow the type.",
            "enum": [
              "start",
              "active",
              "waiting",
              "decision",
              "success",
              "failure",
              "neutral",
              "external"
            ]
          },
          "label": {
            "type": "string",
            "minLength": 1
          },
          "sublabel": {
            "type": "string"
          },
          "tag": {
            "type": "string"
          },
          "icon": {
            "$ref": "common.schema.json#/$defs/nodeIcon"
          },
          "brand": {
            "$ref": "common.schema.json#/$defs/brandMark"
          },
          "sources": {
            "$ref": "common.schema.json#/$defs/sourceReferences"
          },
          "step": {
            "type": "string"
          }
        }
      }
    },
    "transitions": {
      "type": "array",
      "items": {
        "type": "object",
        "additionalProperties": false,
        "required": [
          "from",
          "to"
        ],
        "properties": {
          "id": {
            "$ref": "common.schema.json#/$defs/id"
          },
          "from": {
            "$ref": "common.schema.json#/$defs/id"
          },
          "to": {
            "$ref": "common.schema.json#/$defs/id"
          },
          "label": {
            "type": "string"
          },
          "note": {
            "type": "string"
          },
          "variant": {
            "$ref": "common.schema.json#/$defs/variant"
          }
        }
      }
    },
    "cards": {
      "$ref": "common.schema.json#/$defs/cards"
    }
  }
}
